[
  {
    "id": "cash-game-2026-07-15",
    "slug": "cash-game-2026-07-15",
    "title": "Wednesday 7/15/26",
    "date": "2026-07-15",
    "host": "Matt O.",
    "status": "completed",
    "startTime": "20:00",
    "initialBuyIn": 20,
    "players": [
      {
        "name": "Matt O.",
        "amountBuyIn": 40,
        "amountAtEnd": 65
      },
      {
        "name": "Luke K.",
        "amountBuyIn": 40,
        "amountAtEnd": 41.25
      },
      {
        "name": "Kyser E.",
        "amountBuyIn": 20,
        "amountAtEnd": 42.75
      },
      {
        "name": "Tony P.",
        "amountBuyIn": 40,
        "amountAtEnd": 48.55
      },
      {
        "name": "Sofia M.",
        "amountBuyIn": 60,
        "amountAtEnd": 23.25
      },
      {
        "name": "Adam B.",
        "amountBuyIn": 60,
        "amountAtEnd": 23.3
      },
      {
        "name": "Nate F.",
        "amountBuyIn": 20,
        "amountAtEnd": 11.7
      },
      {
        "name": "Liam M.",
        "amountBuyIn": 20,
        "amountAtEnd": 33.5
      },
      {
        "name": "Justin A.",
        "amountBuyIn": 20,
        "amountAtEnd": 30.05
      }
    ]
  },
  {
    "id": "cash-game-2026-07-18",
    "slug": "cash-game-2026-07-18",
    "title": "Saturday 7/18/26",
    "date": "2026-07-18",
    "host": "Nate F.",
    "status": "completed",
    "startTime": "20:00",
    "initialBuyIn": 20,
    "players": [
      {
        "name": "Nate F.",
        "amountBuyIn": 20,
        "amountAtEnd": 22.5
      },
      {
        "name": "Luke K.",
        "amountBuyIn": 100,
        "amountAtEnd": 40.6
      },
      {
        "name": "Ethan N.",
        "amountBuyIn": 50,
        "amountAtEnd": 0
      },
      {
        "name": "Matt O.",
        "amountBuyIn": 40,
        "amountAtEnd": 53
      },
      {
        "name": "Adam B.",
        "amountBuyIn": 20,
        "amountAtEnd": 143.9
      },
      {
        "name": "Sofia M.",
        "amountBuyIn": 20,
        "amountAtEnd": 31.3
      },
      {
        "name": "Kyser E.",
        "amountBuyIn": 60,
        "amountAtEnd": 0
      },
      {
        "name": "Tony P.",
        "amountBuyIn": 120,
        "amountAtEnd": 148.9
      }
    ]
  },
  {
    "id": "cash-game-2026-07-22",
    "slug": "cash-game-2026-07-22",
    "title": "Wednesday 7/22/26",
    "date": "2026-07-22",
    "host": "Matt O.",
    "status": "completed",
    "startTime": "20:00",
    "initialBuyIn": 20,
    "players": [
      {
        "name": "Matt O.",
        "amountBuyIn": 40,
        "amountAtEnd": 73.75
      },
      {
        "name": "Adam B.",
        "amountBuyIn": 60,
        "amountAtEnd": 19
      },
      {
        "name": "Sofia M.",
        "amountBuyIn": 20,
        "amountAtEnd": 74.5
      },
      {
        "name": "Luke K.",
        "amountBuyIn": 100,
        "amountAtEnd": 15.75
      },
      {
        "name": "Liam M.",
        "amountBuyIn": 40,
        "amountAtEnd": 23.25
      },
      {
        "name": "Nate F.",
        "amountBuyIn": 20,
        "amountAtEnd": 21.75
      },
      {
        "name": "Justin A.",
        "amountBuyIn": 20,
        "amountAtEnd": 30.25
      },
      {
        "name": "Kyser E.",
        "amountBuyIn": 20,
        "amountAtEnd": 34.25
      },
      {
        "name": "Tony P.",
        "amountBuyIn": 20,
        "amountAtEnd": 47.5
      }
    ]
  },
  {
    "id": "cash-game-2026-07-29",
    "slug": "cash-game-2026-07-29",
    "title": "Wednesday 7/29/26",
    "date": "2026-07-29",
    "host": "Matt O.",
    "status": "completed",
    "startTime": "20:00",
    "initialBuyIn": 20,
    "players": [
      {
        "name": "Matt O.",
        "amountBuyIn": 40,
        "amountAtEnd": 20
      },
      {
        "name": "Luke K.",
        "amountBuyIn": 30,
        "amountAtEnd": 33
      },
      {
        "name": "Kyser E.",
        "amountBuyIn": 60,
        "amountAtEnd": 47.75
      },
      {
        "name": "Tony P.",
        "amountBuyIn": 60,
        "amountAtEnd": 45
      },
      {
        "name": "Nate F.",
        "amountBuyIn": 20,
        "amountAtEnd": 24.25
      },
      {
        "name": "Sofia M.",
        "amountBuyIn": 20,
        "amountAtEnd": 48.25
      },
      {
        "name": "Adam B.",
        "amountBuyIn": 60,
        "amountAtEnd": 18.5
      },
      {
        "name": "Justin A.",
        "amountBuyIn": 20,
        "amountAtEnd": 73.25
      }
    ]
  },
  {
    "id": "cash-game-2026-08-05",
    "slug": "cash-game-2026-08-05",
    "title": "Wednesday 8/5/26",
    "date": "2026-08-05",
    "host": "Matt O.",
    "status": "completed",
    "startTime": "20:00",
    "initialBuyIn": 20,
    "players": [
      {
        "name": "Tony P.",
        "amountBuyIn": 20,
        "amountAtEnd": 30.75
      },
      {
        "name": "Kyser E.",
        "amountBuyIn": 20,
        "amountAtEnd": 61.5
      },
      {
        "name": "Matt O.",
        "amountBuyIn": 70,
        "amountAtEnd": 29.25
      },
      {
        "name": "Max M.",
        "amountBuyIn": 20,
        "amountAtEnd": 23.75
      },
      {
        "name": "Liam M.",
        "amountBuyIn": 70,
        "amountAtEnd": 0
      },
      {
        "name": "Luke K.",
        "amountBuyIn": 20,
        "amountAtEnd": 42.75
      },
      {
        "name": "Nate F.",
        "amountBuyIn": 20,
        "amountAtEnd": 31.5
      },
      {
        "name": "Adam B.",
        "amountBuyIn": 40,
        "amountAtEnd": 0
      },
      {
        "name": "Sofia M.",
        "amountBuyIn": 20,
        "amountAtEnd": 73.75
      },
      {
        "name": "Max A.",
        "amountBuyIn": 30,
        "amountAtEnd": 36.75
      }
    ]
  },
  {
    "id": "cash-game-2026-08-08",
    "slug": "cash-game-2026-08-08",
    "title": "Saturday 8/8/26",
    "date": "2026-08-08",
    "host": "Nate F.",
    "status": "completed",
    "startTime": "20:00",
    "initialBuyIn": 20,
    "players": [
      {
        "name": "Luke K.",
        "amountBuyIn": 20,
        "amountAtEnd": 10.4
      },
      {
        "name": "Liam M.",
        "amountBuyIn": 40,
        "amountAtEnd": 0
      },
      {
        "name": "Nate F.",
        "amountBuyIn": 20,
        "amountAtEnd": 42.5
      },
      {
        "name": "Adam B.",
        "amountBuyIn": 20,
        "amountAtEnd": 0
      },
      {
        "name": "Sofia M.",
        "amountBuyIn": 20,
        "amountAtEnd": 0
      },
      {
        "name": "Tony P.",
        "amountBuyIn": 20,
        "amountAtEnd": 61.9
      },
      {
        "name": "Matt O.",
        "amountBuyIn": 20,
        "amountAtEnd": 19.9
      },
      {
        "name": "Kyser E.",
        "amountBuyIn": 20,
        "amountAtEnd": 45.3
      }
    ]
  },
  {
    "id": "cash-game-2026-08-12",
    "slug": "cash-game-2026-08-12",
    "title": "Wednesday 8/12/26",
    "date": "2026-08-12",
    "host": "Luke K.",
    "status": "completed",
    "startTime": "20:00",
    "initialBuyIn": 20,
    "players": [
      {
        "name": "Luke K.",
        "amountBuyIn": 55,
        "amountAtEnd": 38.2
      },
      {
        "name": "Adam B.",
        "amountBuyIn": 20,
        "amountAtEnd": 34.2
      },
      {
        "name": "Sofia M.",
        "amountBuyIn": 20,
        "amountAtEnd": 37.7
      },
      {
        "name": "Nate F.",
        "amountBuyIn": 40,
        "amountAtEnd": 25.4
      },
      {
        "name": "Tony P.",
        "amountBuyIn": 20,
        "amountAtEnd": 25.3
      },
      {
        "name": "Kyser E.",
        "amountBuyIn": 40,
        "amountAtEnd": 0
      },
      {
        "name": "Ally K.",
        "amountBuyIn": 20,
        "amountAtEnd": 47.8
      },
      {
        "name": "Liam M.",
        "amountBuyIn": 20,
        "amountAtEnd": 26.4
      }
    ]
  },
  {
    "id": "cash-game-2026-08-15",
    "slug": "cash-game-2026-08-15",
    "title": "Saturday 8/15/26",
    "date": "2026-08-15",
    "host": "Matt O.",
    "status": "completed",
    "startTime": "20:00",
    "initialBuyIn": 20,
    "players": [
      {
        "name": "Matt O.",
        "amountBuyIn": 60,
        "amountAtEnd": 23.5
      },
      {
        "name": "Luke K.",
        "amountBuyIn": 30,
        "amountAtEnd": 43.75
      },
      {
        "name": "Adam B.",
        "amountBuyIn": 40,
        "amountAtEnd": 52.5
      },
      {
        "name": "Sofia M.",
        "amountBuyIn": 20,
        "amountAtEnd": 21.25
      },
      {
        "name": "Justin A.",
        "amountBuyIn": 20,
        "amountAtEnd": 75.25
      },
      {
        "name": "Calvin A.",
        "amountBuyIn": 20,
        "amountAtEnd": 0
      },
      {
        "name": "Liam M.",
        "amountBuyIn": 20,
        "amountAtEnd": 0
      },
      {
        "name": "Kyser E.",
        "amountBuyIn": 40,
        "amountAtEnd": 24.25
      },
      {
        "name": "Noah S.",
        "amountBuyIn": 20,
        "amountAtEnd": 69.5
      },
      {
        "name": "Tony P.",
        "amountBuyIn": 40,
        "amountAtEnd": 0
      }
    ]
  },
  {
    "id": "cash-game-2026-08-19",
    "slug": "cash-game-2026-08-19",
    "title": "Wednesday 8/19/26",
    "date": "2026-08-19",
    "host": "Matt O.",
    "status": "completed",
    "startTime": "20:00",
    "initialBuyIn": 20,
    "players": [
      {
        "name": "Matt O.",
        "amountBuyIn": 30,
        "amountAtEnd": 34
      },
      {
        "name": "Ally K.",
        "amountBuyIn": 30,
        "amountAtEnd": 0
      },
      {
        "name": "Kyser E.",
        "amountBuyIn": 20,
        "amountAtEnd": 76.5
      },
      {
        "name": "Liam M.",
        "amountBuyIn": 20,
        "amountAtEnd": 43
      },
      {
        "name": "Luke K.",
        "amountBuyIn": 40,
        "amountAtEnd": 40.75
      },
      {
        "name": "Nate F.",
        "amountBuyIn": 50,
        "amountAtEnd": 17.75
      },
      {
        "name": "Adam B.",
        "amountBuyIn": 20,
        "amountAtEnd": 81.25
      },
      {